{
  "decoratorName": "Bullet",
  "version": "1.0.0",
  "description": "Formats the response as a bulleted list, making information easier to scan and digest. This decorator is ideal for presenting sequential steps, key points, or collections of related items in a clean, concise format.",
  "author": {
    "name": "Prompt Decorators Working Group",
    "email": "promptdecoratorspec@synapti.ai",
    "url": "https://synapti.ai"
  },
  "parameters": [
    {
      "name": "style",
      "type": "enum",
      "description": "The visual marker used for bullet points",
      "enum": ["dash", "dot", "arrow", "star", "plus"],
      "default": "dash",
      "required": false
    },
    {
      "name": "indented",
      "type": "boolean",
      "description": "Whether to allow nested, indented bullet points",
      "default": true,
      "required": false
    },
    {
      "name": "compact",
      "type": "boolean",
      "description": "Whether to keep bullet points short and concise (true) or allow longer, more detailed points (false)",
      "default": false,
      "required": false
    }
  ],
  "examples": [
    {
      "description": "Basic bulleted list of key points",
      "usage": "+++Bullet\nWhat are the main factors to consider when buying a laptop?",
      "result": "Presents key laptop purchasing factors as a bulleted list with dash markers"
    },
    {
      "description": "Compact star bullets with nesting disabled",
      "usage": "+++Bullet(style=star, indented=false, compact=true)\nList the benefits of regular exercise.",
      "result": "Provides a flat list of concise, star-bulleted points about exercise benefits, with no nested sub-points"
    }
  ],
  "compatibility": {
    "requires": [],
    "conflicts": ["OutputFormat"],
    "minStandardVersion": "1.0.0",
    "maxStandardVersion": "2.0.0",
    "models": [
      "gpt-4",
      "gpt-3.5-turbo"
    ]
  }
} 